element,issue,status,solution,impact
img[alt=""],Missing alt attributes,FIXED,Added descriptive alt texts,Screen reader accessibility
a[href] without text,Links without recognizable names,FIXED,Added aria-label attributes,Navigation clarity
button elements,Missing focus styles,FIXED,Added visible focus indicators,Keyboard navigation
touch targets,Below 44px minimum,FIXED,Increased mobile button sizes,Touch accessibility
color contrast,Potential contrast issues,MAINTAINED,Kept existing design contrast,Visual accessibility
heading structure,Proper h1-h6 hierarchy,VERIFIED,Confirmed logical heading order,Content structure
form labels,Missing label associations,VERIFIED,All form inputs properly labeled,Form accessibility
skip links,Missing skip navigation,REVIEW_NEEDED,Would require visible UI changes,Navigation efficiency